{
 "schemaVersion": "1.0",
 "version": "2026-10",
 "language": "cs",
 "category": {
  "id": "ss",
  "title": "Střední školy a gymnázia",
  "subtitle": "Šest úrovní AIFB pro 1. až 4. ročník",
  "grades": "1.–4. ročník SŠ",
  "unit": "Level",
  "theme": "clean",
  "usageMode": "individual",
  "audience": "Studenti středních škol a gymnázií (cca 15–19 let); individuální práce, volitelné semináře a ročníkové práce.",
  "source": {
   "document": "AIFB_plan_cviceni_pro_skoly.docx",
   "note": "Strukturovaná verze metodického plánu pro učitele (říjen 2026). Text určený žákům v plánu není; pole pupil je zatím ve stavu todo."
  }
 },
 "guide": [
  {
   "number": "1",
   "id": "g1",
   "title": "Úvod: jak s plánem pracovat",
   "blocks": [],
   "sections": [
    {
     "number": "1.1",
     "id": "g1-1",
     "title": "Účel a struktura plánu",
     "blocks": [
      {
       "type": "p",
       "text": "Tento dokument obsahuje plán cvičení pro výuku praktické gramotnosti v oblasti umělé inteligence podle systému AI Fluency Benchmark (AIFB). Je určen především učitelům informatiky a počítačové vědy na středních školách a gymnáziích, mohou ho však využít i vedoucí seminářů, koordinátoři digitální výchovy nebo lektoři zájmových kroužků. Plán pokrývá všech šest úrovní AIFB, od základů bezpečné práce s AI až po návrh komplexních multiagentních systémů, a nabízí tak ucelenou trajektorii výuky, kterou lze zařadit do běžných hodin informatiky i do volitelných seminářů."
      },
      {
       "type": "p",
       "text": "Každá kapitola věnovaná jedné úrovni má stejnou strukturu, aby se v dokumentu učitel snadno orientoval. Nejprve jsou uvedeny vzdělávací cíle, tedy dovednosti, které by student po absolvování úrovně měl ovládat. Následuje časové rozvržení do bloků, teoretická příprava s opakovacími otázkami a diskuzními tématy, pět konkrétních cvičení se zadáním a očekávaným výstupem a nakonec stručné poznámky pro učitele. Cvičení jsou navržena tak, aby byla proveditelná s běžně dostupnými bezplatnými nástroji a aby jejich zadání bylo možné podle potřeby obměňovat."
      },
      {
       "type": "p",
       "text": "Plán zároveň záměrně neobsahuje kompletní výukové texty ani hotové podklady. Výklad teorie ke každému tématu, vzorové odpovědi k opakovacím otázkám, sady karet, ukázky chybných výstupů či hodnoticí rubriky jsou součástí výukových modulů AIFB na platformě VeVit. Teoretické přípravy v tomto dokumentu vymezují témata a poskytují otázky a diskuze; každé cvičení zároveň přináší návod, jak si potřebné podklady připravit. Dokud moduly nejsou zveřejněny, připraví si učitel podklady samostatně podle zadání uvedených v kapitolách; tento plán je pro výuku samostatným a úplným podkladem."
      },
      {
       "type": "p",
       "text": "Plán je metodickým podkladem, nikoli závaznou osnovou. Učitel může jednotlivé bloky zkrátit, prodloužit nebo přeskládat podle znalostí a vybavení konkrétní třídy. Důležité je zachovat návaznost úrovní: každá úroveň staví na dovednostech z úrovní předchozích, a proto se doporučuje absolvovat je v uvedeném pořadí. Studenti, kteří již mají zkušenosti s některými tématy, mohou odpovídající bloky zrychleně přeskočit na základě ústního nebo písemného vstupního testu."
      }
     ]
    },
    {
     "number": "1.2",
     "id": "g1-2",
     "title": "Časová dotace a organizace výuky",
     "blocks": [
      {
       "type": "p",
       "text": "Orientační časová dotace se u jednotlivých úrovní liší podle náročnosti cvičení: úrovně 1 a 2 se pohybují v rozsahu sedmi až osmi hodin, úroveň 3 v rozsahu osmi až deseti hodin a úrovně 4 až 6 v rozsahu devíti až čtrnácti hodin. Při jedné hodině informatiky týdně tak jedna úroveň odpovídá zhruba dvěma až třem měsícům výuky, které však není nutné umísťovat do souvislého období. Tento rozsah poskytuje dostatek prostoru jak pro teorii, tak pro samostatné procvičování, a zároveň není natolik náročný, aby znemožnil plnění ostatních témat učebních osnov. U nejvyšších úrovní lze část práce, zejména práci na vlastních projektech, přenést do domácí přípravy."
      },
      {
       "type": "table",
       "caption": "Doporučené členění úrovně na výukové bloky (rámcově pro úrovně 1 a 2)",
       "header": [
        "Část výuky",
        "Obsah",
        "Podíl na dotaci"
       ],
       "rows": [
        [
         "Teoretická příprava",
         "Vysvětlení pojmů, opakovací otázky, diskuze ve třídě.",
         "cca 2 hodiny"
        ],
        [
         "Cvičení 1 a 2",
         "První dvě cvičení úrovně, samostatná nebo párová práce.",
         "cca 2 hodiny"
        ],
        [
         "Cvičení 3 a 4",
         "Navazující cvičení, procvičení dovedností úrovně.",
         "cca 2 hodiny"
        ],
        [
         "Cvičení 5 a shrnutí",
         "Závěrečné cvičení, společná reflexe a vyhodnocení.",
         "1 až 2 hodiny"
        ]
       ]
      },
      {
       "type": "p",
       "text": "Výuka nejméně poloviny cvičení probíhá u počítače, a proto je vhodné plánovat úrovně do hodin v počítačové učebně. Teoretickou přípravu lze naopak vést i v běžné třídě, což se hodí v týdnech, kdy je počítačová učebna obsazená. Pokud škola vyučuje informatiku v blocích po dvou hodinách, doporučuje se spojit teoretickou přípravu s prvním cvičením a zbývající cvičení rozdělit do dalších bloků. Vždy platí, že poslední hodina úrovně by měla obsahovat společné shrnutí, ve kterém třída vyhodnotí, co se podařilo, a učitel odpoví na otevřené otázky."
      }
     ]
    },
    {
     "number": "1.3",
     "id": "g1-3",
     "title": "Pomůcky a technické požadavky",
     "blocks": [
      {
       "type": "p",
       "text": "Požadavky na vybavení jsou u jednotlivých úrovních odlišné, protože se liší i zaměření a náročnost témat. Následující přehled slouží k časnému naplánování, aby technické překážky nezpomalily průběh výuky. U všech úrovní se předpokládá počítač pro každého studenta nebo alespoň pro dvojici a funkční připojení k internetu."
      },
      {
       "type": "list",
       "ordered": false,
       "items": [
        "**Úrovně 1 až 3:** webový prohlížeč a přístup ke konverzačnímu nástroji. Dbejte na věkové podmínky služeb: ChatGPT nesmí používat děti do 13 let a nezletilí do 18 let potřebují souhlas zákonného zástupce, Claude je určen až od 18 let a Gemini je přístupný i mladším teenagerům s doplňkovými ochranami. Pro práci ve třídě se proto doporučuje jeden sjednocený nástroj pro celou třídu a účty spravované učitelem; nástroje, ke kterým studenti přístup nemají, učitel prezentuje z vlastního účtu. Sdílení jednoho účtu více osobami podmínky některých služeb nepovolují, proto upřednostněte vzdělávací nebo školní variantu nástroje, pokud ji poskytovatel nabízí. Pro úroveň 3 dále školní účet v automatizačním nástroji (například n8n nebo Make) a přístup k jednomu veřejnému API s volnými požadavky, obojí spravované dospělým.",
        "**Úrovně 4 a 5:** nainstalovaný Python ve verzi 3.10 nebo novější, editor kódu (například VS Code) a školní účet u poskytovatele API modelů s nastaveným limitem útraty. Celou úroveň 4 lze provozovat i bez placených služeb: lokální model spuštěný v nástroji Ollama zpřístupňuje kompatibilní rozhraní API, na kterém lze absolvovat všechna cvičení bez poplatků. Pro úroveň 5 je vhodný počítač s alespoň 8 GB paměti pro spuštění lokálního modelu.",
        "**Úroveň 6:** prostředí z úrovní 4 a 5 doplněné o knihovny pro multiagentní systémy (například CrewAI nebo LangGraph), vektorovou databázi (například Chroma) a prostor pro uložení dokumentů, nad kterými budou studenti budovat vyhledávání. I zde lze využít lokální modely a obejít se tak bez placených služeb.",
        "**Společné:** projektor nebo sdílená obrazovka pro ukázky, tabule pro schémata pracovních postupů a vytištěné podklady pro cvičení, která nevyžadují počítač. Všechny uvedené nástroje jsou příklady ve výuce ověřených služeb; můžete je nahradit ekvivalentem se stejnou funkcí."
       ]
      },
      {
       "type": "p",
       "text": "Před zahájením první hodiny úrovně si učitel ověří, že všichni studenti mají funkční přístup k požadovaným nástrojům, a domluví se s provozovatelem školní sítě na případném uvolnění potřebných služeb. Součástí přípravy by mělo být i seznámení se s podmínkami užívání jednotlivých služeb, zejména s omezeními věku uživatelů a se zásadami zpracování osobních údajů, kterým se věnuje následující oddíl."
      }
     ]
    },
    {
     "number": "1.4",
     "id": "g1-4",
     "title": "Pravidla bezpečné a odpovědné práce",
     "blocks": [
      {
       "type": "p",
       "text": "Práce s nástroji umělé inteligence ve školním prostředí přináší specifické povinnosti, které je třeba se studenty probrat na začátku první úrovně a průběžně je připomínat. Základním pravidlem je, že do konverzačních nástrojů nikdy nezadávají osobní údaje, ať vlastní nebo svých spolužáků a učitelů. To se týká jména, adresy, data narození, fotografií, zdravotních informací i údajů, které by mohly vést k identifikaci konkrétní osoby. Stejně opatrně je třeba zacházet se školními dokumenty, které mohou obsahovat citlivé informace."
      },
      {
       "type": "p",
       "text": "Druhým pilířem je odpovědnost za výstupy. Studenti se učí, že odpovědi modelů mohou být nepřesné nebo zcela vymyšlené, a proto se u každého vážného výsledku ověřuje zdroj. Výstupy AI se vždy označují jako takové, a to i v domácích úkolech a seminárních pracích. Škola si zároveň stanoví jasná pravidla, kdy je použití AI dovolené: v úrovních AIFB je AI předmětem výuky a proto i povoleným nástrojem, v jiných předmětech platí pokyny konkrétního učitele. Tato pravidla se doporučuje shrnout do krátké smlouvy o používání AI, kterou třída na začátku kurzu projedná a přijme."
      },
      {
       "type": "p",